{
  "cert_id": "pac_bayes_constant_v1_pass",
  "cert_version": "QA_PAC_BAYES_CONSTANT_CERT.v1",
  "created_utc": "2026-02-27T00:00:00Z",
  "system": {
    "N": 16,
    "M": 24,
    "C": 1.0,
    "M_is_even": true
  },
  "constants": {
    "K1_formula": "2*C^2*N*(M/2)^2",
    "K1_expected": 4608.0,
    "K1_recomputed": 4608.0,
    "tolerance_abs": 1e-9
  },
  "pac_inputs": {
    "delta": 0.05,
    "m": 1000,
    "risk_hat": 1.0,
    "D_QA": 57.259645783023906,
    "bound_variant": "QA_DQA",
    "notes": "Pure Tone tight experiment from signal_pac_results_tight.json (N=16, M=24, m=1000, informed Gaussian prior, optimal transport D_QA). Phase-1 script formula: bound = risk_hat + sqrt((K1*D_QA + log(1/delta))/m)."
  },
  "pac_outputs": {
    "bound_percent": 1724,
    "bound_percent_recomputed": 1724,
    "initial_bound_percent": 5585,
    "tight_bound_percent": 1813,
    "improvement_ratio": 3.1,
    "improvement_ratio_recomputed": 3.1,
    "rounding_policy": {
      "percent_round_dp": 0,
      "ratio_round_dp": 1
    }
  },
  "dpi": {
    "claim": "structured_only",
    "random_trials": {
      "n_trials": 100,
      "violation_rate": 0.518,
      "seed_used_for_structured_demo": 42
    }
  },
  "digests": {
    "canonical_sha256": "894e6ed080e46879a76f034aa163d9ae1281d58e51e1d8aa1c4fd82e31da4c2b"
  }
}
